The Cyber Policies Behind Critical Infrastructure: A Look at the Preparedness of the Top Nuclear Energy-Producing Nations,http://scholarship.claremont.edu/cmc_theses/3642,2024-05-22,published,85
The Danger of Deepfakes: Information Pollution and Epistemic Insecurity,http://scholarship.claremont.edu/cmc_theses/3750,2025-01-28,published,27
The Dangers of Corporate Champions: The East India Company's Devastating Impact on Britain,http://scholarship.claremont.edu/cmc_theses/1694,2017-05-22,published,7824
The Data Chain: Exploring a New Dynamic for Consumer Data Control and Economic Value,http://scholarship.claremont.edu/cmc_theses/3284,2023-05-25,published,1
The De Havilland Law - How One Woman stood up to the Hollywood System,http://scholarship.claremont.edu/cmc_theses/2088,2019-02-15,published,2
The Deadweight Loss of Equity-Based Compensation,http://scholarship.claremont.edu/cmc_theses/947,2014-05-24,published,363
"The Death of the American Dream: How Inequality, Injustice, and Individualism Shatters Its Promise as a Unifying Force",http://scholarship.claremont.edu/cmc_theses/3808,2025-01-31,published,33
The Decentralizing Process of Mexican Independence,http://scholarship.claremont.edu/cmc_theses/437,2012-05-18,published,16
"The Decline of Contemporary Protest Music: A Textual Analysis of Political Protest Music During the Bush, Obama, and Trump Presidencies",http://scholarship.claremont.edu/cmc_theses/3091,2022-09-09,published,917
The Declining Natural Fish Stock: A Proposed Solution to Public Fear and Perceptions of Genetically Modified Fish,http://scholarship.claremont.edu/cmc_theses/765,2013-12-26,published,726
The Definition of Leadership in the Indian Entertainment Industry,http://scholarship.claremont.edu/cmc_theses/1621,2017-05-22,published,7
The Demand for the Unconditioned in the Antinomies: A Defense of Kant,http://scholarship.claremont.edu/cmc_theses/1320,2016-05-26,published,155
The Demandingness of Morality: The Person Confined,http://scholarship.claremont.edu/cmc_theses/1498,2017-01-09,published,709
The Democratic Progressive Party: Self-regulation of Secessionist Rhetoric,http://scholarship.claremont.edu/cmc_theses/1511,2017-01-10,published,2
The Democratic Self Amid the American Renaissance,http://scholarship.claremont.edu/cmc_theses/2495,2020-06-18,published,3
The Denial of Transcendental Freedom is Self-Refuting,http://scholarship.claremont.edu/cmc_theses/2066,2019-02-15,published,158
The Dentist / Patient Relationship: The Role of Dental Anxiety,http://scholarship.claremont.edu/cmc_theses/277,2011-12-20,published,2609
The Deontological and Utilitarian Cases for Rectifying Structural Injustice in Sweatshop Labor Ethics: A Critical Assessment,http://scholarship.claremont.edu/cmc_theses/923,2014-05-24,published,11130
The Deployment of Prophecy: Power and Politics of the Catholic Church,http://scholarship.claremont.edu/cmc_theses/3611,2024-05-22,published,2
The Determinants of Firm Profitability: The Effect of Social Media,http://scholarship.claremont.edu/cmc_theses/958,2014-05-24,published,2540
The Development Of Personal Status Law In Jordan & Iraq,http://scholarship.claremont.edu/cmc_theses/865,2014-05-24,published,3316
The Development and Long-Term Influences of Attachments As Seen Through Attachment Theory: The Influence of Attachment on Homosexual Males,http://scholarship.claremont.edu/cmc_theses/66,2010-12-01,published,2612
"The Development of Entrepreneurial Decision Making: The Effect of Feedback and Gender on Risk Taking, Confidence and Decision Making",http://scholarship.claremont.edu/cmc_theses/1146,2015-05-19,published,3
"The Development of Washington, D.C. and the Rise of Political Disconnect",http://scholarship.claremont.edu/cmc_theses/1627,2017-05-22,published,2
The Development of an English Antislavery Identity in the Eighteenth Century,http://scholarship.claremont.edu/cmc_theses/1367,2016-05-26,published,356
The Devil's Dirge,http://scholarship.claremont.edu/cmc_theses/2933,2022-05-31,published,2
The Differences in the Unemployment Effects of the Great Recession and the COVID-19 Pandemic in the United States: Evidence from Counties with Different Income Levels,http://scholarship.claremont.edu/cmc_theses/2868,2022-01-14,published,14
The Differential Impacts of COVID-19 on the Correlations and Volatility of the S&P500 and the Nifty50,http://scholarship.claremont.edu/cmc_theses/2598,2021-02-12,published,2
The Differentiating Personal and Tactical Dimensions of Head Coaches in the NFL: Why is Bill Belichick Successful When Others Are Not?,http://scholarship.claremont.edu/cmc_theses/1465,2017-01-05,published,9578
The Digital Puppetmaster,http://scholarship.claremont.edu/cmc_theses/1791,2018-01-17,published,230
The Digitalization of Development: Understanding the Role of Technology and Innovation in Development through a Case Study of Kenya and M-Pesa,http://scholarship.claremont.edu/cmc_theses/2062,2019-02-15,published,566
The Dilutive Nature of Special Purpose Acquisition Companies and the Looming Threat of SEC Regulation,http://scholarship.claremont.edu/cmc_theses/2763,2021-06-11,published,5
The Disappearing Middle Class: Implications for Politics and Public Policy,http://scholarship.claremont.edu/cmc_theses/412,2012-05-18,published,4184
The Disproportionate Effect of Economic Crisis on Minority Communities,http://scholarship.claremont.edu/cmc_theses/2539,2021-02-12,published,7
The Dock,http://scholarship.claremont.edu/cmc_theses/1406,2016-05-26,published,1
The Domestic Sphere and the Era of Streaming: How Shame has been Weaponized to create Self-Care,http://scholarship.claremont.edu/cmc_theses/2388,2020-06-18,published,1
The Draw of The Sprawl: Commuting and the Inland Empire,http://scholarship.claremont.edu/cmc_theses/824,2014-05-20,published,8
The Drivers of Corporate Headquarter Relocations and the Effects of the Announcements on Stock Market Returns,http://scholarship.claremont.edu/cmc_theses/589,2013-05-21,published,6
The Drivers of Monthly IPO Volume,http://scholarship.claremont.edu/cmc_theses/244,2011-12-19,published,7
The Drivers of Success in the NFL: Differences in Factors Affecting the Probability of Winning Based on First Half Performance,http://scholarship.claremont.edu/cmc_theses/1371,2016-05-26,published,3601
The Drug War in Mexico: Consequences for Mexico's Nascent Democracy,http://scholarship.claremont.edu/cmc_theses/143,2011-05-06,published,6477
The Duality of Gnome,http://scholarship.claremont.edu/cmc_theses/2743,2021-06-11,published,88
The Due Process Clause: Analyzing The Supreme Court's Substantive Due Process Jurisprudence,http://scholarship.claremont.edu/cmc_theses/1608,2017-05-19,published,6
The Dynamic Relationship Between Young Spanish Catholics and the Church,http://scholarship.claremont.edu/cmc_theses/2688,2021-06-11,published,1314
"The Earning Gap of Criminality: Effects of Stigma, Length and Form of Incarceration",http://scholarship.claremont.edu/cmc_theses/432,2012-05-18,published,423
The Earnings Effects of Conscription: Lessons from Conscription Reforms in the Netherlands and Italy,http://scholarship.claremont.edu/cmc_theses/2248,2019-06-13,published,2
The Economic Impact of H1B Visa Approvals on Industry Specific GDP,http://scholarship.claremont.edu/cmc_theses/3504,2024-01-29,published,297
The Economic Impact of Oil Price Shocks on Emerging Markets,http://scholarship.claremont.edu/cmc_theses/139,2011-05-06,published,3777
"The Economic Implications of Hosting the NBA Finals on a County’s Personal Income, GDP Per Capita, and Unemployment Rate",http://scholarship.claremont.edu/cmc_theses/2815,2022-01-14,withdrawn,2
"The Economic Implications of Hosting the NBA Finals on a County’s Personal Income, Gross Domestic Product, and Unemployment Rate",http://scholarship.claremont.edu/cmc_theses/2956,2022-05-31,published,3
The Economic Implications of NBA Player Achievements on Athletic Apparel Companies,http://scholarship.claremont.edu/cmc_theses/1895,2018-05-30,published,1100
The Economic and Philosophic Manuscripts of Data,http://scholarship.claremont.edu/cmc_theses/2648,2021-06-11,published,159
The Economics of Hosting the Olympic Games: The Miscalculation of Cost-Benefit Analyses and Why Cities Continue to Bid,http://scholarship.claremont.edu/cmc_theses/1264,2015-12-23,published,5755
The Effect Direct Shipment of Alcohol Has on the Three-Tier Distribution System,http://scholarship.claremont.edu/cmc_theses/257,2011-12-20,published,7
The Effect Of Tax Loss Harvesting On Momentum In The U.S. Stock Market: An Intra Industry Group Study,http://scholarship.claremont.edu/cmc_theses/956,2014-05-24,published,6
The Effect of Age upon CEO Compensation: A Cross-Industry Study,http://scholarship.claremont.edu/cmc_theses/11,2010-11-29,published,1443
The Effect of Ammonia Prices on Corn Prices in the United States,http://scholarship.claremont.edu/cmc_theses/3403,2024-01-19,published,12
The Effect of Announcements about Electric Vehicle Developments on Traditional Automakers' Stock Prices,http://scholarship.claremont.edu/cmc_theses/2915,2022-02-09,published,18
The Effect of Bat Predation on Crop Yield in Thailand and the Winter Garden Region of South-Central Texas,http://scholarship.claremont.edu/cmc_theses/1727,2018-01-10,published,5
The Effect of Business Tax to Value-Added Tax Reform on Tax Burdens and R&D Investments of the High and New Technology Enterprises in China,http://scholarship.claremont.edu/cmc_theses/2240,2019-06-13,published,2
The Effect of CEO Compensation Practices on the Performance of Korean Conglomerates,http://scholarship.claremont.edu/cmc_theses/3176,2023-01-17,published,0
The Effect of CEO Equity Compensation on the Performance of Silicon Valley Technology Firms,http://scholarship.claremont.edu/cmc_theses/2786,2021-06-11,published,6
"The Effect of CEO Gender, Age, and Salary On Firm Value",http://scholarship.claremont.edu/cmc_theses/1059,2015-01-20,published,2861
"The Effect of CFO Gender On: Auditor Turnover, Audit Fees, and Financial Reporting Timeliness",http://scholarship.claremont.edu/cmc_theses/2086,2019-02-15,published,17
The Effect of COVID-19 on Cross-Border Tax Avoidance For Washington Border Counties,http://scholarship.claremont.edu/cmc_theses/3267,2023-05-23,published,2
The Effect of Changes in US Money Supply on S&P 500 Returns During the Global Financial Crisis and COVID-19 Recession,http://scholarship.claremont.edu/cmc_theses/3372,2023-06-06,published,2697
The Effect of Changing Environmental Factors on the Resurgence of Dengue Fever and Severe Dengue,http://scholarship.claremont.edu/cmc_theses/1308,2016-02-08,published,2
The Effect of Chinese Capital Control Liberalizations on Shanghai Stock Market Integration,http://scholarship.claremont.edu/cmc_theses/1746,2018-01-10,published,20
The Effect of Climate Change on Food Security in Sub-Saharan Africa,http://scholarship.claremont.edu/cmc_theses/1070,2015-01-20,published,7
The Effect of Comprehensive Privacy Legislation on Firms’ Stock Returns: Empirical Evidence from California’s CCPA and CPRA,http://scholarship.claremont.edu/cmc_theses/2714,2021-06-11,published,1
The Effect of Corporate Sustainability Reporting on Firm Valuation,http://scholarship.claremont.edu/cmc_theses/489,2013-01-04,published,5358
The Effect of Culture and Islam on the Use of International Financial Reporting Standards: Case of the Middle East,http://scholarship.claremont.edu/cmc_theses/1051,2015-01-20,published,13
The Effect of Culture on Female Labor Force Partcipation,http://scholarship.claremont.edu/cmc_theses/101,2011-04-29,published,1523
The Effect of Culture on the Implementation of International Financial Reporting Standards,http://scholarship.claremont.edu/cmc_theses/165,2011-05-06,published,13620
The Effect of Drought and Exotic Species on the Post-Fire Response of Artemisia californica,http://scholarship.claremont.edu/cmc_theses/2529,2021-02-12,published,0
The Effect of Excise Taxes on Cigarette Smuggling: An Instrumental Variable Approach,http://scholarship.claremont.edu/cmc_theses/764,2013-12-26,published,1051
The Effect of Executive Compensation on Firm Performance through the Dot-Com Bubble,http://scholarship.claremont.edu/cmc_theses/415,2012-05-18,published,896
The Effect of Fast Food Restaurants on Type 2 Diabetes Rates,http://scholarship.claremont.edu/cmc_theses/1819,2018-01-17,published,4015
The Effect of Feedback and Knowledge Activation on Suggestibility to Misinformation,http://scholarship.claremont.edu/cmc_theses/2481,2020-06-18,published,0
The Effect of Firm ESG Performance on the Cost of Issuing Corporate Bonds in the U.S. Debt Market,http://scholarship.claremont.edu/cmc_theses/2547,2021-02-12,published,28
"The Effect of Free Trade Agreements on Innovation: Evidence from US Bilateral Free Trade Agreements with Australia, Chile, Singapore, and South Korea",http://scholarship.claremont.edu/cmc_theses/3312,2023-05-26,published,560
The Effect of Gender Diversity on Liquidity Risk and Bank Performance,http://scholarship.claremont.edu/cmc_theses/1856,2018-05-30,published,3
The Effect of Heavy and Light Rail Transportation Systems on Car Ownership,http://scholarship.claremont.edu/cmc_theses/600,2013-05-22,published,4
The Effect of In-Country Conflict on the Labor Market Outcomes of Immigrants from Syria and Lebanon,http://scholarship.claremont.edu/cmc_theses/2149,2019-06-13,published,0
The Effect of Increased Regulation on Option Use Within the Information Technology Industry,http://scholarship.claremont.edu/cmc_theses/1276,2015-12-23,published,134
The Effect of Increasing Information in the Major League Baseball Trade Market,http://scholarship.claremont.edu/cmc_theses/1028,2015-01-20,published,5
The Effect of Institutional Shareholding on the Informational Efficiency of Stock Prices: Evidence from the Hang Seng Index,http://scholarship.claremont.edu/cmc_theses/1029,2015-01-20,published,5
The Effect of International NGOs on Influencing Domestic Policy and Law,http://scholarship.claremont.edu/cmc_theses/1866,2018-05-30,published,7341
The Effect of Mandatory Adoption of IFRS on Transparency for Investors,http://scholarship.claremont.edu/cmc_theses/1946,2018-05-30,published,1338
The Effect of Mortality Salience on Death Penalty Sentencing Decisions when the Defendant is Severely Mentally Ill.,http://scholarship.claremont.edu/cmc_theses/1421,2016-05-26,published,14
The Effect of Natural Disasters on Volunteerism,http://scholarship.claremont.edu/cmc_theses/916,2014-05-24,published,1612
"The Effect of Negative Media on Political Campaigns: Hillary Clinton, Margaret Thatcher",http://scholarship.claremont.edu/cmc_theses/702,2013-06-05,published,6
The Effect of Negative Special Items on Future Income in Different Sectors,http://scholarship.claremont.edu/cmc_theses/1361,2016-05-26,published,4
The Effect of Neighborhood Crime Rates on Childhood Obesity in Los Angeles County,http://scholarship.claremont.edu/cmc_theses/2247,2019-06-13,published,372
The Effect of Oil Market Developments on Price Volatility and U.S.-Saudi Relations,http://scholarship.claremont.edu/cmc_theses/351,2012-05-17,published,59
The Effect of Organized Sports on Academic Achievement and Youth Development,http://scholarship.claremont.edu/cmc_theses/782,2013-12-29,published,13751
The Effect of Perceived Intentions to Harm and Implicit Theories of Personality on Moral Judgments of Favoritism and Discrimination,http://scholarship.claremont.edu/cmc_theses/829,2014-05-20,published,2
The Effect of Pre-College Activity Participation on College Leadership,http://scholarship.claremont.edu/cmc_theses/680,2013-05-23,published,46
The Effect of Remaining Lease Term and Buyer Type on Retail Real Estate Capitalization Rate: A Case Study of Dollar General Transactions from 2007-2021,http://scholarship.claremont.edu/cmc_theses/3292,2023-05-25,published,2
The Effect of Securities Class Action Lawsuits on Investor Sentiment,http://scholarship.claremont.edu/cmc_theses/3136,2023-01-13,published,6
The Effect of Shifting Cases from District Courts to Administrative Proceedings at the Securities and Exchange Commission,http://scholarship.claremont.edu/cmc_theses/2274,2019-06-13,published,1
The Effect of Signaling Activity by Commodity Producing Companies on Future Operating Performance and Future Commodity Returns,http://scholarship.claremont.edu/cmc_theses/2494,2020-06-18,published,5
The Effect of Spotify’s Podcast-Related Initiatives on Its Value,http://scholarship.claremont.edu/cmc_theses/2672,2021-06-11,published,19
The Effect of Stress Coping Techniques in Sports,http://scholarship.claremont.edu/cmc_theses/1240,2015-12-23,published,5016
The Effect of Third Party Litigation Funding on Dismissal  Rates in Product Liability Multidistrict Litigation,http://scholarship.claremont.edu/cmc_theses/2314,2020-01-31,published,5
"The Effect of Tommy John Surgery on MLB Starting Pitcher Performance, 2017-2023",http://scholarship.claremont.edu/cmc_theses/3568,2024-05-22,published,102
The Effect of Topical DNA Repair Enzymes on Mutation of the p53 Gene,http://scholarship.claremont.edu/cmc_theses/2675,2021-06-11,published,0
The Effect of Variations in US Policy Toward Taiwan on US – China Relations,http://scholarship.claremont.edu/cmc_theses/3754,2025-01-28,published,25
The Effect of Visual Alcohol Cues on Risk Taking Behavior Based on Memory Primes and Individual Drinking Habits,http://scholarship.claremont.edu/cmc_theses/3379,2023-06-06,published,100
The Effect of the Change in Call Loan Rates and Volatility on Stock Returns in 1929: An Empirical Study into a Determinant of the Great Depression,http://scholarship.claremont.edu/cmc_theses/1912,2018-05-30,published,431
The Effect of the Establishment of the Day Clearing Branch on Trading Costs: A Look at the NYSE In 1920,http://scholarship.claremont.edu/cmc_theses/689,2013-05-23,published,124
"The Effect of the Georgia Senate Runoff Election on the Intradaily Returns of Renewable Energy, Cannabis, and Oil",http://scholarship.claremont.edu/cmc_theses/2703,2021-06-11,published,14
The Effect of the Introduction of a Clearinghouse on Trading Costs: The New York Stock Exchange in the 1890s,http://scholarship.claremont.edu/cmc_theses/290,2011-12-20,published,339
The Effect of the iA Writer iPad Application on the Writing Skills of Children with Autism Spectrum Disorders,http://scholarship.claremont.edu/cmc_theses/641,2013-05-22,published,10
The Effect that Hurricanes have on Unemployment in Coastal Counties in the United States,http://scholarship.claremont.edu/cmc_theses/571,2013-05-20,published,8
The Effective Application of Microfinance to Alleviate Poverty in the Indigenous Populations of Peru and Bolivia,http://scholarship.claremont.edu/cmc_theses/511,2013-01-04,published,25
The Effectiveness of ASEAN under External Pressure: Cases of Myanmar's Accession and the South China Sea Disputes,http://scholarship.claremont.edu/cmc_theses/769,2013-12-28,published,1688
The Effectiveness of Collaboration Within Supply Chain Management: A Case Study of Adidas Group,http://scholarship.claremont.edu/cmc_theses/2078,2019-02-15,published,4699
The Effectiveness of Government Responses to the Coronavirus: A Comparative Analysis of The United States and Canada,http://scholarship.claremont.edu/cmc_theses/2700,2021-06-11,published,7
The Effectiveness of Housing First in Reducing Homelessness in the United States,http://scholarship.claremont.edu/cmc_theses/3353,2023-06-06,published,308
The Effectiveness of International Law in Upholding the Rights of Refugees,http://scholarship.claremont.edu/cmc_theses/965,2014-05-24,published,7
The Effectiveness of State Policy in Combating Prescription Drug Abuse and Overdose,http://scholarship.claremont.edu/cmc_theses/833,2014-05-21,published,7
The Effects On a State When They Lose Their Senior Senator,http://scholarship.claremont.edu/cmc_theses/41,2010-11-30,published,814
The Effects of  El Nino and La Nina Weather Events on Corn Futures Prices,http://scholarship.claremont.edu/cmc_theses/1085,2015-05-19,published,0
The Effects of AI on Recruiting in the Accounting Field,http://scholarship.claremont.edu/cmc_theses/3401,2024-01-19,published,244
The Effects of Age on Working Memory Capacity and Neural Function,http://scholarship.claremont.edu/cmc_theses/3245,2023-05-23,published,0
"The Effects of Bringing an NBA Franchise to a City on Employment: A Case Study of Memphis, Oklahoma City, Orlando, Sacramento, and Salt Lake City",http://scholarship.claremont.edu/cmc_theses/1847,2018-05-30,published,2840
The Effects of CFO Gender on Earnings Quality and Financial Risk,http://scholarship.claremont.edu/cmc_theses/3013,2022-06-02,published,0
The Effects of Childhood Maltreatment on Attachment Throughout Life,http://scholarship.claremont.edu/cmc_theses/2367,2020-06-18,published,0
The Effects of Climate Change on the Geographical Range of Lyme Disease in the United States as Determined by Changing Tick Distributions,http://scholarship.claremont.edu/cmc_theses/922,2014-05-24,published,5
The Effects of Co-Occurrence on the Collaborative Process of Establishing a Reference,http://scholarship.claremont.edu/cmc_theses/1417,2016-05-26,published,11
The Effects of Cognitive Load and Stereotyped Groups on Punitiveness,http://scholarship.claremont.edu/cmc_theses/1438,2016-05-26,published,881
The Effects of Communication Disorders on Social Development,http://scholarship.claremont.edu/cmc_theses/77,2010-12-01,published,22494
The Effects of Connectivity on GDP per Capita Across Diverse Economic Landscapes,http://scholarship.claremont.edu/cmc_theses/2101,2019-02-15,published,11
"The Effects of Containment, Regional Interdependence, and Monetary Policy on Latin American Stock Market Returns during the COVID-19 Pandemic",http://scholarship.claremont.edu/cmc_theses/2759,2021-06-11,published,6
The Effects of Dsk1 and Kic1 Kinase on Phosphatase Clp1 in Mitotic Regulation,http://scholarship.claremont.edu/cmc_theses/2804,2022-01-14,published,4
The Effects of Efficient Innovation on Industry Stock Returns During 2008 Financial Crisis,http://scholarship.claremont.edu/cmc_theses/1605,2017-05-19,published,6
The Effects of Exchange Traded Funds on Emerging Market Equities,http://scholarship.claremont.edu/cmc_theses/727,2013-12-24,published,7
The Effects of Experience and Familiarity on Performance in Virtual Environments,http://scholarship.claremont.edu/cmc_theses/1420,2016-05-26,published,4
The Effects of Expert Testimony in Sexual Assault Trials,http://scholarship.claremont.edu/cmc_theses/1114,2015-05-19,published,1030
The Effects of Financial Liberalization in Myanmar and its Implications for Exchange Rates & Monetary Policy,http://scholarship.claremont.edu/cmc_theses/2220,2019-06-13,published,4
The Effects of Forestry Regulations on Rural Communities and the Urban-Rural Divide in Oregon,http://scholarship.claremont.edu/cmc_theses/1069,2015-01-20,published,1094
The Effects of Gender Diversity in Boards and Top Management of Companies,http://scholarship.claremont.edu/cmc_theses/1377,2016-05-26,published,17
"The Effects of Gender Stereotypes and Types of Crime on Perceptions of Responsibility, Sentencing Severity, and Likelihood of Recidivism",http://scholarship.claremont.edu/cmc_theses/3365,2023-06-06,published,2833
The Effects of Gender and COVID-19 on Labor Force participation in the United Kingdom between 2015 and 2021,http://scholarship.claremont.edu/cmc_theses/3191,2023-01-17,published,9
The Effects of Government Relief in the Airline Industry,http://scholarship.claremont.edu/cmc_theses/3231,2023-05-23,published,3
The Effects of Humor when Coping with Stress,http://scholarship.claremont.edu/cmc_theses/2551,2021-02-12,published,5800
The Effects of Industry on Cross-Border and Domestic IPO Underpricing,http://scholarship.claremont.edu/cmc_theses/128,2011-05-05,published,666
The Effects of Isolation on Anxiety: A Review of the Evidence,http://scholarship.claremont.edu/cmc_theses/2792,2021-08-27,published,7
The Effects of Juror Need for Cognition: Perceptions of Trustworthiness in Expert Witness Testimony,http://scholarship.claremont.edu/cmc_theses/335,2012-05-17,published,13
The Effects of Luxury Brands’ Social Media Marketing on Purchase Intention and Consumer Behavior,http://scholarship.claremont.edu/cmc_theses/2026,2019-02-14,published,15
The Effects of Macroeconomic Indicators and Event Shocks on Greek Stock and Bond Market Performance,http://scholarship.claremont.edu/cmc_theses/1423,2016-05-26,published,25
The Effects of Macroeconomic Policy Shifts on US Housing Market Pricing Throughout the Covid-19 Pandemic,http://scholarship.claremont.edu/cmc_theses/3164,2023-01-17,published,3
The Effects of Managerial Turnover on Share Prices Of Publicly Traded English Football Teams,http://scholarship.claremont.edu/cmc_theses/1378,2016-05-26,published,58
The Effects of Measure ULA on the Commercial Real Estate Market in the City of Los Angeles,http://scholarship.claremont.edu/cmc_theses/3683,2024-05-22,published,3
The Effects of Moderate High Fructose Corn Syrup Consumption on Predisposition to Developing Type II Diabetes,http://scholarship.claremont.edu/cmc_theses/467,2012-05-18,published,14
The Effects of NAFTA and Domestic Reforms on the Development of Mexico’s Agriculture Sector,http://scholarship.claremont.edu/cmc_theses/926,2014-05-24,published,3
The Effects of Netflix and Blockbuster Strategies on Firm Value,http://scholarship.claremont.edu/cmc_theses/154,2011-05-06,published,19235
The Effects of Oil Supply Shocks on U.S. Stock Market Returns,http://scholarship.claremont.edu/cmc_theses/312,2012-05-17,published,5
The Effects of Ownership on Bank Performance:  A Study of Commercial Banks in China,http://scholarship.claremont.edu/cmc_theses/515,2013-01-04,published,30
