Mobilization and Polarization: American Jewish Politics Following the 2016 Election,http://scholarship.claremont.edu/cmc_theses/2453,2020-06-18,published,270
Mobster Pioneers: A Western Jewish Perspective on the Founders of Modern Las Vegas,http://scholarship.claremont.edu/cmc_theses/2008,2019-02-14,published,7
Model Specification for Bank Failure: A Retrospective Look at Banks in Missouri during the Great Depression,http://scholarship.claremont.edu/cmc_theses/1765,2018-01-17,published,126
Model Specification for CMBS Loan Default: A Retrospective Look at CMBS Performance Through the Great Recession,http://scholarship.claremont.edu/cmc_theses/1935,2018-05-30,published,6
Modeling Baseball as a Markov Chain to Optimize Average Runs Per Game,http://scholarship.claremont.edu/cmc_theses/2722,2021-06-11,published,4
Modeling Cryptocurrency Price Using 1-D Stochastic Differential Equations,http://scholarship.claremont.edu/cmc_theses/3307,2023-05-25,published,1
Modeling Returns on Carbon Emission Allowances: An Application to RGGI,http://scholarship.claremont.edu/cmc_theses/2102,2019-02-15,published,172
Modeling State-Level Heterogeneity in Coronavirus Pandemic Outcomes,http://scholarship.claremont.edu/cmc_theses/3485,2024-01-22,published,8
Modeling the Performance-based Compensation of MLB Catchers,http://scholarship.claremont.edu/cmc_theses/3155,2023-01-17,published,334
"Modern Escapism: A Field Guide OR, How to Get Lost Without Really Trying",http://scholarship.claremont.edu/cmc_theses/937,2014-05-24,published,8
Modern Media Strategy: Analyzing the Success of Propaganda During the Nazi Regime,http://scholarship.claremont.edu/cmc_theses/3469,2024-01-22,published,11
"Modern Supreme Court Jurisprudence Through the Lens of the Federalist Papers, the Anti-Federalist Papers, and Obergefell v. Hodges",http://scholarship.claremont.edu/cmc_theses/1748,2018-01-10,published,14
Modern-Day Hearing Impairment:  The Role of Environmental Factors and Lifestyle Choices,http://scholarship.claremont.edu/cmc_theses/3480,2024-01-22,published,69
Modernizing Oregon's Liquor Control Commission,http://scholarship.claremont.edu/cmc_theses/549,2013-05-20,published,6
Modi’s India: How Modi And the BJP Used Social Media and Misinformation to Gain Social Control In India,http://scholarship.claremont.edu/cmc_theses/3279,2023-05-25,published,2
Molecular Modeling of Novel Tryptamine Analogs with Antibiotic Potential Through Their Inhibition of Tryptophan Synthase,http://scholarship.claremont.edu/cmc_theses/1656,2017-05-22,published,381
"Mom, Dad, Help Please: The Home Environment’s Influences on a Child’s Math Ability",http://scholarship.claremont.edu/cmc_theses/1664,2017-05-22,published,2173
Momentum Crashes and Industry Composition,http://scholarship.claremont.edu/cmc_theses/1582,2017-05-19,published,28
"Monetary Policy and its Effects on the Greater China Housing Market: a Comparative Analysis of Mainland China, Hong Kong and Taiwan",http://scholarship.claremont.edu/cmc_theses/1159,2015-05-19,published,25
"Monetary Policy, Business Cycles, and the Behavior of Small Manufacturing Firms",http://scholarship.claremont.edu/cmc_theses/696,2013-06-05,published,12
Money Craving in China and Korea: Football Club Performance and the Share Prices of Owning Corporations,http://scholarship.claremont.edu/cmc_theses/1044,2015-01-20,published,60
Money Talks: Free Speech and Political Equality in Campaign Finance Reform,http://scholarship.claremont.edu/cmc_theses/263,2011-12-20,published,21
"Money Talks: Turkey, The Kurdish Regional Government, and the Shaping of a Future Kurdish State",http://scholarship.claremont.edu/cmc_theses/1566,2017-05-17,published,4
Money and Power: Industry Concentration as a Determinant of Corporate Lobbying Activity,http://scholarship.claremont.edu/cmc_theses/2145,2019-06-13,published,15
"Money, Power, & Politics:  Firm Lobbying Dynamics and Expenditures",http://scholarship.claremont.edu/cmc_theses/2637,2021-06-11,published,4
Montanita: A Modern Augmented Reality System,http://scholarship.claremont.edu/cmc_theses/789,2013-12-30,published,18
Monte Carlo Methods in Option Pricing,http://scholarship.claremont.edu/cmc_theses/2122,2019-06-13,published,3
Monte Carlo Simulation and Integration,http://scholarship.claremont.edu/cmc_theses/2009,2019-02-14,published,2
Mood and Perceived Fairness: The Context Dependency of Empathy,http://scholarship.claremont.edu/cmc_theses/318,2012-05-17,published,20
Moral Agency and Advancements in Artificial Intelligence,http://scholarship.claremont.edu/cmc_theses/36,2010-11-30,published,794
Moral Consistency in the Value of Embryonic and Fetal Human Life: Trying to Reconcile Abortion Opposition and Parent-Friendly IVF Practices Under a Full Moral Value Stance,http://scholarship.claremont.edu/cmc_theses/3774,2025-01-30,published,0
Moral Hazard in Monetary Policy: Assessing the Impact of the Federal Reserve Actions on Asset Returns during the COVID-19 Pandemic,http://scholarship.claremont.edu/cmc_theses/3028,2022-06-02,published,8
Moral Hazards and Negative Externalities of Lifesaving Programs: How Naloxone Access Laws and Prescription Drug Monitoring Programs Affect HIV Transmission,http://scholarship.claremont.edu/cmc_theses/2446,2020-06-18,published,179
"Moral Realism through Intuitionism: understanding justification, confirmation, and disagreement",http://scholarship.claremont.edu/cmc_theses/2364,2020-06-18,published,3
Moral Relativism: Can One Community Give Another a Reason to Change?,http://scholarship.claremont.edu/cmc_theses/1167,2015-05-19,published,416
Moral Self-Deception and Psychological Egoism,http://scholarship.claremont.edu/cmc_theses/3177,2023-01-17,published,9
Moralize through Sympathy: An Analysis of Adam Smith’s Sentimentalist Moral Theory,http://scholarship.claremont.edu/cmc_theses/3348,2023-06-06,published,53
More Like Real Estate or Stocks? An Analysis of REIT Volatility and Returns by Property Type,http://scholarship.claremont.edu/cmc_theses/2385,2020-06-18,published,2
More Than a Bath: An Examination of Japanese Bathing Culture,http://scholarship.claremont.edu/cmc_theses/665,2013-05-23,published,19373
More Than a Feeling: Exploring the Drivers of Music Catalog Values,http://scholarship.claremont.edu/cmc_theses/3482,2024-01-22,published,352
More than a Myth: The Benefits of Incorporating Holistic Healing Methods from Native American and Mexican Cultures to Approach Opioid Use Disorder (OUD) Treatment,http://scholarship.claremont.edu/cmc_theses/2586,2021-02-12,published,459
Morphological Changes in Dorsal Root Ganglia Macrophages Associated with Neuropathic Pain Mechanisms Suggest a Novel Target for Chronic Pain Therapy,http://scholarship.claremont.edu/cmc_theses/2523,2021-02-12,published,507
Mortgaging California’s Future: The Politics of California’s Housing Shortage,http://scholarship.claremont.edu/cmc_theses/2170,2019-06-13,published,7
"Moscow, We Have a Problem: Russia's Inconsistent Approach to the Evolving Concept of Sovereignty in the 21st Century",http://scholarship.claremont.edu/cmc_theses/821,2014-05-20,published,181
Motivation Behind Volunteerism,http://scholarship.claremont.edu/cmc_theses/4,2010-11-29,published,24934
"Mouse Model Behavior in APP/PS1 Mice Treated with a BBB-penetrating Erythropoietin Fusion Protein, cTfRMAb-EPO",http://scholarship.claremont.edu/cmc_theses/2092,2019-02-15,published,2
Move Fast and Get Sued: Uber's Entry Strategy and the Role of City Regulation,http://scholarship.claremont.edu/cmc_theses/3748,2025-01-28,published,17
"Movement as Medicine: Dance/Movement Therapy for Individuals with Autism, Parkinson’s Disease, and Cancer",http://scholarship.claremont.edu/cmc_theses/3113,2023-01-13,published,537
Movimientos de Secesión en España: ¿Como puede responder el gobierno?,http://scholarship.claremont.edu/cmc_theses/2168,2019-06-13,published,9
Moving Away From Regulation and Legislation: Solving the Network Neutrality Debate During Obama’s Presidency,http://scholarship.claremont.edu/cmc_theses/13,2010-11-30,published,496
Moving to the Beat of Djembe Drums: African Dance and Reported Feelings of Depression,http://scholarship.claremont.edu/cmc_theses/46,2010-12-01,published,1040
Mulan: Journey in a Time of Change,http://scholarship.claremont.edu/cmc_theses/2196,2019-06-13,published,3
Multicultural Education: What is it and Does it Have Benefits?,http://scholarship.claremont.edu/cmc_theses/64,2010-12-01,published,21580
Multifractional Brownian Motion and Its Applications to Factor Analysis on Consumer Confidence Index,http://scholarship.claremont.edu/cmc_theses/2790,2021-06-11,published,655
Multipolar Melting Pot: A Spatial Analysis of Political Orientation in the United States,http://scholarship.claremont.edu/cmc_theses/3587,2024-05-22,published,46
Munui (??): Modern Adaptations of Korean Folk and Fairy Tales,http://scholarship.claremont.edu/cmc_theses/1911,2018-05-30,published,5
Music Festivals: A Secondary Market Analysis,http://scholarship.claremont.edu/cmc_theses/1338,2016-05-26,published,10753
Music Therapy and Its Effects on Cognitive and Mental Health,http://scholarship.claremont.edu/cmc_theses/2950,2022-05-31,published,10
Musical Activism: A Case Study of Janelle Monáe and Her Digitized Revolution of Love,http://scholarship.claremont.edu/cmc_theses/2117,2019-06-13,published,0
My Physical-Digital Self: Exploring the Detrimental Effects of the Metaverse on Relationship & Identity Development,http://scholarship.claremont.edu/cmc_theses/3188,2023-01-17,published,554
Mysteries of the Gothic,http://scholarship.claremont.edu/cmc_theses/3237,2023-05-23,published,162
Mystical Experience and Epistemic Injustice,http://scholarship.claremont.edu/cmc_theses/2037,2019-02-14,published,357
"NAFTA's Impact on Mexico, the U.S., and Canada's Economies: A Look at Stock Returns",http://scholarship.claremont.edu/cmc_theses/1364,2016-05-26,published,15
NATO History and Future,http://scholarship.claremont.edu/cmc_theses/242,2011-12-19,published,10
NFL Betting Market: Using Adjusted Statistics to Test Market Efficiency and Build a Betting Model,http://scholarship.claremont.edu/cmc_theses/721,2013-12-22,published,2735
NFL Positional Value In Terms of Salary Cap Spending: Why Are Running Backs Undervalued?,http://scholarship.claremont.edu/cmc_theses/3640,2024-05-22,published,146
NFT-Related Companies: Token Sale Returns,http://scholarship.claremont.edu/cmc_theses/2869,2022-01-14,published,1394
NGO Terror: Why Regimes Restrict NGOs,http://scholarship.claremont.edu/cmc_theses/611,2013-05-22,published,14
NLRB vs. the Boeing Company: Implications of the Board's Overreach,http://scholarship.claremont.edu/cmc_theses/231,2011-12-19,published,4
NMR Fecal Metabolomics of Peromyscus maniculatus,http://scholarship.claremont.edu/cmc_theses/3849,2025-02-03,published,0
National Culture and Internal Control,http://scholarship.claremont.edu/cmc_theses/738,2013-12-24,published,7
National and Regional Bank Deposits and Their Relationship to the Stock Market,http://scholarship.claremont.edu/cmc_theses/3759,2025-01-28,published,7
Nationalizing Nature: A Critique of the English National Trust Interpretation of Stowe Landscape Garden,http://scholarship.claremont.edu/cmc_theses/1805,2018-01-17,published,1170
Native American Gaming Jurisprudence: An Analysis of the Supreme Court's Tribal Gaming Decisions and Their Effects on Tribal Sovereignty,http://scholarship.claremont.edu/cmc_theses/1005,2015-01-20,published,22
Native Newspapers: The Emergence of the American Indian Press 1960-Present,http://scholarship.claremont.edu/cmc_theses/638,2013-05-22,published,285
Navigating New Capital Sources: Financing Constraints and the Growth of Private Credit,http://scholarship.claremont.edu/cmc_theses/3760,2025-01-28,published,8
Nazism and Eric Voegelin’s Politische Religionen: An Approach to Exploring Nazism’s Roots in Modern Thought,http://scholarship.claremont.edu/cmc_theses/3466,2024-01-21,published,259
"Nearly Halfway There: The Future of Hong Kong, China, and One Country Two Systems",http://scholarship.claremont.edu/cmc_theses/2439,2020-06-18,published,1787
Negative Emotion Arousal for Attitude and Behavioral Changes in Captive Animal Documentary,http://scholarship.claremont.edu/cmc_theses/2549,2021-02-12,published,9
"Negotiating Human Rights Abuses through the Moral Foundations Theory: An Attempt to Understand the Moral Motivations behind the Male Guardianship System in Saudi Arabia, Female Genital Modification, and Child Marriage.",http://scholarship.claremont.edu/cmc_theses/1473,2017-01-05,published,986
Negotiating Intersectionality: Women in the Civil Rights Movement and the Zapatista National Liberation Front,http://scholarship.claremont.edu/cmc_theses/1640,2017-05-22,published,3
Network Analysis of Passing Patterns in Handball,http://scholarship.claremont.edu/cmc_theses/1947,2018-05-30,published,508
Neural Basis of Kinship Recognition in Rats,http://scholarship.claremont.edu/cmc_theses/2620,2021-06-11,published,4
Neural Mechanisms Underlying the Pupillary Contagion Effect,http://scholarship.claremont.edu/cmc_theses/2958,2022-05-31,published,11
Neural Networks: Building a Better Index Fund,http://scholarship.claremont.edu/cmc_theses/1666,2017-05-22,published,11
Neural Responses to Vibration during Wobble Board Balancing,http://scholarship.claremont.edu/cmc_theses/196,2011-05-09,published,733
Neural Underpinnings of the Framing Effect: Increased Inhibition of the Default Mode Network May Explain The Foreign-Language Effect,http://scholarship.claremont.edu/cmc_theses/2331,2020-01-31,published,0
Neurodivergence Needs Assessment for Claremont McKenna College Students,http://scholarship.claremont.edu/cmc_theses/3704,2024-05-22,published,1
Neurodiversity Support and Inclusion in Higher Education,http://scholarship.claremont.edu/cmc_theses/3484,2024-01-22,published,1
Neuropeptide CGRP Suppresses Th17 Cytokine IL-17A Production,http://scholarship.claremont.edu/cmc_theses/3486,2024-01-22,published,2
"Never Look Away: Changing Societal Norms to Eradicate Domestic Violence in Tamil Nadu, India",http://scholarship.claremont.edu/cmc_theses/1289,2015-12-23,published,379
New Breed Leaders in Indonesian Democracy: A Critical Pluralist Examination of Ganjar Pranowo's Election as Governor of Central Java Province in 2013,http://scholarship.claremont.edu/cmc_theses/1127,2015-05-19,published,1
New Evidence on the Stock Price Reaction Following Convertible Bond Issuance Announcements in Japan,http://scholarship.claremont.edu/cmc_theses/1100,2015-05-19,published,4
"New Media, An Academic Perspective",http://scholarship.claremont.edu/cmc_theses/602,2013-05-22,published,721
Nietzschean Ethics: One's Duty to Overcome,http://scholarship.claremont.edu/cmc_theses/1342,2016-05-26,published,2396
Nixon’s Jaded Teenagers: Measuring the Cohort Effects of Watergate,http://scholarship.claremont.edu/cmc_theses/1131,2015-05-19,published,4
No Accounting for Taste: Luxury Counterfeiting in Today's Retail Industry,http://scholarship.claremont.edu/cmc_theses/1533,2017-01-10,published,18
"No Longer the ""White Trash of Asia"" -- What Now? Australia Breaks the Record for Longest Economic Expansion in OECD History",http://scholarship.claremont.edu/cmc_theses/1957,2018-05-30,published,28
"No Pain, No Gain: Australia, UK, and US Stock Market Responses to the 2020 Stimulus Efforts",http://scholarship.claremont.edu/cmc_theses/2557,2021-02-12,published,108
No Shifty Business: Investigating the Effect of the COVID-19 Pandemic on Classification Shifting,http://scholarship.claremont.edu/cmc_theses/3719,2025-01-27,published,0
Non-Governmental Organization Vulnerabilities: Donors and Resource Dependence,http://scholarship.claremont.edu/cmc_theses/1429,2016-05-26,published,9624
Non-Secularism in Middle Eastern Politics: Causes and Implications,http://scholarship.claremont.edu/cmc_theses/2851,2022-01-14,published,33
Non-Uniform Effects of Aging Across Tasks: An EEG/ERP Study,http://scholarship.claremont.edu/cmc_theses/2794,2021-08-27,published,0
Non-farm Rural Employment in Latin America: Help Small Landowners Make the Transition,http://scholarship.claremont.edu/cmc_theses/682,2013-05-23,published,7
Nonperforming Loans: Asset Pricing and Determinants of Profitability,http://scholarship.claremont.edu/cmc_theses/1933,2018-05-30,published,1076
Nonprofit Organizations: A New Method to Increase the Quality of Education in the United States,http://scholarship.claremont.edu/cmc_theses/2045,2019-02-15,published,13
Norm Dynamics in the Digital Age: Exploring How Online Environments Influence Norms,http://scholarship.claremont.edu/cmc_theses/3710,2024-05-22,published,0
North Korea’s China Shock,http://scholarship.claremont.edu/cmc_theses/3150,2023-01-17,published,20
Not From My Wallet: Mental Accounting For Peer-To-Peer Digital-Payments,http://scholarship.claremont.edu/cmc_theses/2668,2021-06-11,published,636
Not Our Fight Alone: An Analysis of the US Strategy Combating the Islamic State of Iraq and Syria,http://scholarship.claremont.edu/cmc_theses/1036,2015-01-20,published,2427
Nramp Metal Transporter Gene Contributes to Copper Resistance in Staphylococcus epidermidis,http://scholarship.claremont.edu/cmc_theses/3675,2024-05-22,published,0
Nudging Towards Social Change: The Application of Psychology and Behavioral Economics in Promoting Responsible Consumption,http://scholarship.claremont.edu/cmc_theses/1641,2017-05-22,published,1464
Nukes and Niceties: North Korea’s Warming Tensions and Growing Nuclear Power,http://scholarship.claremont.edu/cmc_theses/2035,2019-02-14,published,6
"Nusantara: The Social, Economic, Political, and Environmental Implications of Moving the Heart of Indonesia’s Government",http://scholarship.claremont.edu/cmc_theses/3132,2023-01-13,published,16
OLS Price Analysis of Magic: The Gathering,http://scholarship.claremont.edu/cmc_theses/3277,2023-05-25,published,1
OPENING THE COFFIN: The Weight of Suffering and Survival in Hong Kong’s Coffin Homes,http://scholarship.claremont.edu/cmc_theses/3794,2025-01-30,published,7
"Obama, Trump, and Xi: Three South China Sea Strategies in the U.S.-China Battle for Global Hegemony",http://scholarship.claremont.edu/cmc_theses/2499,2020-06-18,published,2531
Objectification and Meaning Transference: Does Showing More Skin Mean Less Perceived Agency for Brands?,http://scholarship.claremont.edu/cmc_theses/3650,2024-05-22,published,50
Objective-Motivated Drivers of Financial Efficiency and Transparency  in Not-For-Profit Organizations,http://scholarship.claremont.edu/cmc_theses/3799,2025-01-30,published,1
Objectivity and the Role of Journalism in Democratic Societies,http://scholarship.claremont.edu/cmc_theses/1057,2015-01-20,published,8295
Obligation vs. Economy: The Morality and Economic Complications of Capital Punishment,http://scholarship.claremont.edu/cmc_theses/1034,2015-01-20,published,1
Obscure U: Complexity and Complicity in For-Profit University Financial Statements,http://scholarship.claremont.edu/cmc_theses/1294,2015-12-23,published,336
Observing the Effects of Antimalarial Drug Availability on Women’s Work Absenteeism,http://scholarship.claremont.edu/cmc_theses/2350,2020-01-31,published,84
Observing the Effects of Diversity on Performance in Ugandan Primary Schools,http://scholarship.claremont.edu/cmc_theses/2456,2020-06-18,published,272
Obstructive Sleep Apnea: An Unmet and Unique Public Health Crisis,http://scholarship.claremont.edu/cmc_theses/2830,2022-01-14,published,0
Occupy This: The Effect of Income Inequality on GDP Per Capita Growth Using Panel Data in the United States from 1963 to 2009,http://scholarship.claremont.edu/cmc_theses/311,2012-05-17,published,826
"Okay Google, When Should We Go Public: Can Google Trends Predict IPOs?",http://scholarship.claremont.edu/cmc_theses/2415,2020-06-18,published,2
Omni-Channel Retail and the New Age Consumer: An Empirical Analysis of Direct-to-Consumer Channel Interaction in the Retail Industry,http://scholarship.claremont.edu/cmc_theses/590,2013-05-21,published,12713
"On ""Thinking Outside the Box""",http://scholarship.claremont.edu/cmc_theses/1470,2017-01-05,published,18
On Black Anger: An Analytic-Philosophical Response to the Problem of Social Value,http://scholarship.claremont.edu/cmc_theses/1848,2018-05-30,published,6
On Collective Self-Determination and a Palestinian State,http://scholarship.claremont.edu/cmc_theses/8,2010-11-29,published,544
On Locke's Atheism,http://scholarship.claremont.edu/cmc_theses/2447,2020-06-18,published,2
On Smooth Projective Toric Fano 4-Folds,http://scholarship.claremont.edu/cmc_theses/3829,2025-01-31,published,0
On The Road with the VanLife Community: The Art of Storytelling in the Age of Instagram,http://scholarship.claremont.edu/cmc_theses/1087,2015-05-19,published,2234
On properties of positive semigroups in lattices and totally real number fields,http://scholarship.claremont.edu/cmc_theses/2717,2021-06-11,published,122
On the Brink of Collapse: Examining the Failure of Institutional Governance over Hydropower Development in the Mekong Basin,http://scholarship.claremont.edu/cmc_theses/2396,2020-06-18,published,0
On the Brink: The Impact of Nuclear Weapons on Conflict Behavior Between States,http://scholarship.claremont.edu/cmc_theses/2593,2021-02-12,published,295
On the Characterization of Prime Sets of Polynomials by Congruence Conditions,http://scholarship.claremont.edu/cmc_theses/993,2015-01-20,published,791
On the Purpose & Ethics of Elite Higher Education,http://scholarship.claremont.edu/cmc_theses/1713,2017-05-22,published,14
On the Relationship Between Misperceptions of Randomness and the Self-Serving Bias,http://scholarship.claremont.edu/cmc_theses/675,2013-05-23,published,3
On the Total Communicative Efficacy of Music and Its Synthesis to Written Word through Bob Dylan and Kendrick Lamar,http://scholarship.claremont.edu/cmc_theses/2785,2021-06-11,published,665
On the Wrongs of Fake News,http://scholarship.claremont.edu/cmc_theses/2742,2021-06-11,published,2124
One Hell of a Drug: Counter Insurgency as a US Anti-Drug Trafficking Strategy in Latin America and its Effect on Democratic Institutions,http://scholarship.claremont.edu/cmc_theses/1334,2016-05-26,published,7
"One People, One Nation, One Power? Re-Evaluating the Role of the Federal Plenary Power in Immigration",http://scholarship.claremont.edu/cmc_theses/425,2012-05-18,published,460
One-Bit Compressive Sensing with Partial Support Information,http://scholarship.claremont.edu/cmc_theses/1194,2015-05-19,published,300
Only Child,http://scholarship.claremont.edu/cmc_theses/2840,2022-01-14,published,54
Open Source and Electronic Voting: A New Strategy Toward Technical Procurement for Voting Systems,http://scholarship.claremont.edu/cmc_theses/919,2014-05-24,published,591
Operating Leverage and Systematic Risk of the U.S. Airline Industry,http://scholarship.claremont.edu/cmc_theses/2148,2019-06-13,published,2
Opportunistic Behavior in Major League Baseball: The Contract Year Phenomenon and The Shirking Effect,http://scholarship.claremont.edu/cmc_theses/861,2014-05-24,published,2
Optimal Execution in Cryptocurrency Markets,http://scholarship.claremont.edu/cmc_theses/2387,2020-06-18,published,1859
"Optimize Your Fitness, Optimize Your Business: The Balanced Scorecard, Analysis and Application for the CrossFit Affiliate",http://scholarship.claremont.edu/cmc_theses/1973,2018-05-30,published,3127
Optimizing Random Searches in High Density Environments,http://scholarship.claremont.edu/cmc_theses/2799,2022-01-14,published,18
Optimizing Router Performance,http://scholarship.claremont.edu/cmc_theses/2511,2020-06-18,published,247
Optimizing Urbanization in South Asia,http://scholarship.claremont.edu/cmc_theses/1571,2017-05-17,published,25
Opting Into Medicaid Expansion under the Patient Protection and Affordable Care Act and Hospital Performance,http://scholarship.claremont.edu/cmc_theses/1324,2016-05-26,published,9
Organized Crime Violence in Mexico,http://scholarship.claremont.edu/cmc_theses/568,2013-05-20,published,1156
Organized Labour’s Impact on the 2020 Election,http://scholarship.claremont.edu/cmc_theses/2774,2021-06-11,published,495
Ousted: An Analysis of the Dismissal Gap Between Male and Female CEOs,http://scholarship.claremont.edu/cmc_theses/3018,2022-06-02,published,0
Out of Bounds: How Race and Gender Have Shaped Women's Basketball,http://scholarship.claremont.edu/cmc_theses/2816,2022-01-14,published,14
Outside the Box: Using a Sibling Training Protocol to Increase Imaginative Play Among Autistic Children,http://scholarship.claremont.edu/cmc_theses/3020,2022-06-02,published,162
Over-Wintering Grounds Social Behavior of White-Crowned Sparrows,http://scholarship.claremont.edu/cmc_theses/3046,2022-06-02,published,24
Overcoming the Challenges of Food Deserts,http://scholarship.claremont.edu/cmc_theses/2705,2021-06-11,published,5
Overcoming the Obstacles to Sustainability in Ghana,http://scholarship.claremont.edu/cmc_theses/206,2011-05-09,published,986
Ovid's Metamorphoses: Myth and Religion in Ancient Rome,http://scholarship.claremont.edu/cmc_theses/1483,2017-01-09,published,13
Ownership Investments into Sports Franchises: A New Asset Class,http://scholarship.claremont.edu/cmc_theses/3356,2023-06-06,published,7
Owning Green: Evaluating the Effects of Actively Managed Sustainability Fund Ownership on ESG Scores,http://scholarship.claremont.edu/cmc_theses/3689,2024-05-22,published,76
"Owning Our Implicit Attitudes: Responsibility, Resentment, and the Whole Self",http://scholarship.claremont.edu/cmc_theses/1749,2018-01-10,published,364
"PIPE Discounts, Premia, and Performance",http://scholarship.claremont.edu/cmc_theses/2129,2019-06-13,published,1741
