Do There Exist Industry-Specific Predictors of Deal Failure in Technology M&A?,http://scholarship.claremont.edu/cmc_theses/2074,2019-02-15,published,9
Do the Best Things Really Come To Those Who Wait?  An Analysis of Canadian Wait Times and the Decision to Leave,http://scholarship.claremont.edu/cmc_theses/546,2013-05-17,published,2
Do the Lifetime Prevalence and Prognosis of Schizophrenia Differ Among World Regions?,http://scholarship.claremont.edu/cmc_theses/1978,2018-05-30,published,964
Documentary: Vintage LA,http://scholarship.claremont.edu/cmc_theses/3228,2023-05-18,published,2
Does Age Matter? Comparing CEO Age and Social Media Success in Startups,http://scholarship.claremont.edu/cmc_theses/1685,2017-05-22,published,12
Does Complexity Pay? A Study on the Effectiveness of Various Forms of Regression at Fundamental Analysis,http://scholarship.claremont.edu/cmc_theses/2294,2020-01-31,published,5
Does Depreciation Matter to Investors?,http://scholarship.claremont.edu/cmc_theses/1692,2017-05-22,published,8
Does Discrimination Exist in the National Hockey League?  An Analysis of Racial Salary Discrimination in the NHL (2012-2017),http://scholarship.claremont.edu/cmc_theses/1916,2018-05-30,published,6
Does Firm Payout Behavior Serve as a Signal for Future Profitability?,http://scholarship.claremont.edu/cmc_theses/3373,2023-06-06,published,65
Does Fundamental Analysis Lead to a Rudimentary Momentum Strategy for the Inexperienced Investor? Evidence from a Student Investment Fund,http://scholarship.claremont.edu/cmc_theses/1492,2017-01-09,published,750
Does Growth Drive Valuation? An Analysis of Percent Revenue Growth as a Multiples-Based Valuation Method in Public Mergers and Acquisitions,http://scholarship.claremont.edu/cmc_theses/1980,2018-05-30,published,11
Does H1-B Visa Restriction Hinder American Innovation?,http://scholarship.claremont.edu/cmc_theses/3027,2022-06-02,published,4
Does It Pay to Be Responsible? An Analysis of the Relationship Between Corporate Social Responsibility  and Corporate Financial Performance,http://scholarship.claremont.edu/cmc_theses/3152,2023-01-17,published,15
Does Managerial Risk-Taking Incentive for R&D Investments Translate to Future Earnings?,http://scholarship.claremont.edu/cmc_theses/2199,2019-06-13,published,197
Does Medical and Recreational Marijuana Legalization Decrease Alcohol Consumption in the United States?,http://scholarship.claremont.edu/cmc_theses/2923,2022-05-31,published,1
Does Seclusion Alter Amygdala Activity and Amygdala-Medial Prefrontal Cortex Connectivity Leading to Emotional Dysregulation in Children? A Case for Ending Seclusion and Restraint In Public Schools,http://scholarship.claremont.edu/cmc_theses/2940,2022-05-31,published,220
Does Size and Industry Affect CEO Performance? The Effect of CEO Succession Announcements on Firm Value,http://scholarship.claremont.edu/cmc_theses/1410,2016-05-26,published,6
Does Tanking Work? Evidence from the NBA,http://scholarship.claremont.edu/cmc_theses/1012,2015-01-20,published,16
Does Wall Street Love Federal Reserve?,http://scholarship.claremont.edu/cmc_theses/1468,2017-01-05,published,29
Does a Change in a Logo Affect the Value of the Brand? The Case of Starbucks,http://scholarship.claremont.edu/cmc_theses/386,2012-05-18,published,5055
Does an Academy Award affect Stock Return?,http://scholarship.claremont.edu/cmc_theses/185,2011-05-09,published,984
Does going “Green” pay? The Impact of the Corporate ESG score on a Company’s Cost of Debt,http://scholarship.claremont.edu/cmc_theses/3269,2023-05-23,published,3
Does it Pay to be Moral? A Look into Stock Market Response to ESG Disclosure in the U.S. Financial Services Industry.,http://scholarship.claremont.edu/cmc_theses/2807,2022-01-14,published,7
"Does the Apple Fall Far from the Tree? Exploring a Three-Tiered Relationship Between Family SES, Adolescent Self-Efficacy, and Adult Income",http://scholarship.claremont.edu/cmc_theses/2546,2021-02-12,published,5
Does the Constitution Follow the Flag? The Paradox of Puerto Rican Identity and Citizenship,http://scholarship.claremont.edu/cmc_theses/3541,2024-05-22,published,113
Does the Mind Extend Out into the World,http://scholarship.claremont.edu/cmc_theses/98,2011-04-29,published,553
Does the Provision of Healthcare Vary with Race? Evidence from Health Shocks to Patients Far From Home,http://scholarship.claremont.edu/cmc_theses/247,2011-12-19,published,153
Does the REIT Tale Wag the Dog? The Relationship Between Tenant Ownership and the Volatility of Retail REIT Stock Returns,http://scholarship.claremont.edu/cmc_theses/451,2012-05-18,published,1012
Does the Use of Financial Derivatives Affect Distance-to-Default: Evidence from U.S. Bank Holding Companies,http://scholarship.claremont.edu/cmc_theses/1650,2017-05-22,published,3
Does the Weapon of Mass Destruction Impact Masses Equally? Examining the Disproportionate Impacts of Nuclear Weapons,http://scholarship.claremont.edu/cmc_theses/3011,2022-06-02,published,683
Doing Well While Doing Good? The Cost of Responsible Investing,http://scholarship.claremont.edu/cmc_theses/3338,2023-06-06,published,161
Domestic Violence: The Psychology Behind Male Battery and the Future of Batterer Intervention Programs,http://scholarship.claremont.edu/cmc_theses/1788,2018-01-17,published,6
Don Quijote lo Interminable: La Cuestión de los Textos Originales y las Emanaciones a Través de Formas Secundarias de Arte,http://scholarship.claremont.edu/cmc_theses/522,2013-01-04,published,5
Donald Trump v. The Electorate: A Twitter Feud for the Ages,http://scholarship.claremont.edu/cmc_theses/2690,2021-06-11,published,421
Donald Trump’s Authoritarianism: The Decline of Democracy Under Trump,http://scholarship.claremont.edu/cmc_theses/2845,2022-01-14,published,2960
Don’t Get Screwed: What Factors Determine the Inclusion of J. Crew Blockers?,http://scholarship.claremont.edu/cmc_theses/2536,2021-02-12,published,661
"Don’t Worry, College Doesn’t Make You Successful In the NBA",http://scholarship.claremont.edu/cmc_theses/1490,2017-01-09,published,452
Double Loss: The Economics of Death,http://scholarship.claremont.edu/cmc_theses/1373,2016-05-26,published,15
Doña Rosa’s Story: How Defiant Women are Made,http://scholarship.claremont.edu/cmc_theses/3662,2024-05-22,published,4
Dr. YouTube is Ready to See You Now! Health Benefits of Medical Videos on YouTube,http://scholarship.claremont.edu/cmc_theses/293,2011-12-20,published,634
"Dress, Dogma, and Defiance: Navigating Religio-Colonialist Saviorism in the Realm of Sartorial Liberation",http://scholarship.claremont.edu/cmc_theses/3509,2024-01-29,published,117
Driven by Change: The Impact of Macroeconomic Shifts and COVID-19 on New Vehicle Sales,http://scholarship.claremont.edu/cmc_theses/3445,2024-01-21,published,166
Driving Under the Influence of Ads: The Relationship between Roadside Advertising and Traffic Accidents in Massachusetts,http://scholarship.claremont.edu/cmc_theses/1374,2016-05-26,published,4
Droit de Suite in the United States: The American Royalties Too (ART) Act of 2014,http://scholarship.claremont.edu/cmc_theses/927,2014-05-24,published,3
Drone-Based Topographic Monitoring of the Doheny Beach Replenishment Project as an Alternative to Land-Based Monitoring,http://scholarship.claremont.edu/cmc_theses/3699,2024-05-22,published,51
Dropping the Ball: A Political and Economic Analysis of Public Subsidization for Stadium Construction Projects,http://scholarship.claremont.edu/cmc_theses/2756,2021-06-11,published,1708
Drought Measures and The Coffee Girl: A Creative Writing Thesis,http://scholarship.claremont.edu/cmc_theses/1151,2015-05-19,published,121
"Drought Tolerant Landscaping Trends in Claremont, California",http://scholarship.claremont.edu/cmc_theses/3048,2022-06-02,published,324
Dueling with Distrust and Dual Loyalty: Palestinian Identity in Jordan from 1988 to 1994,http://scholarship.claremont.edu/cmc_theses/1166,2015-05-19,published,4
Durability of Bone,http://scholarship.claremont.edu/cmc_theses/2160,2019-06-13,published,136
Duty for Imagination:  A Philosophical Analysis of Imagination & Defined Benefit Pension Accounting,http://scholarship.claremont.edu/cmc_theses/2595,2021-02-12,published,8
Dynamic Bargaining Agreements Between Three Players,http://scholarship.claremont.edu/cmc_theses/1018,2015-01-20,published,5
Dynamic Connectedness Between Crypto Mining Operations and ERCOT Power Prices,http://scholarship.claremont.edu/cmc_theses/3663,2024-05-22,published,3
Dynamic Motivation to Lead: Construct Validity of Motivation to Lead,http://scholarship.claremont.edu/cmc_theses/2254,2019-06-13,published,4244
Dynamic Nonlinear Gaussian Model for Inferring a Graph Structure on Time Series,http://scholarship.claremont.edu/cmc_theses/3005,2022-06-02,published,145
EGFR Signaling Regulates Tuft Cell Generation in the Adult Mouse Small Intestine,http://scholarship.claremont.edu/cmc_theses/3427,2024-01-21,published,0
EL INMIGRANTE EN EL CINE DEL SIGLO XXI: UN ANÁLISIS DE LA IDENTIDAD INDOCUMENTADA Y SUS ESFUERZOS POR MANTENER UNA COMUNIDAD UNIDA DENTRO Y FUERA DE LA PANTALLA,http://scholarship.claremont.edu/cmc_theses/2784,2021-06-11,published,622
ESG Disclosures & Materiality,http://scholarship.claremont.edu/cmc_theses/2011,2019-02-14,published,27
ESG Factors as a Determinant for Firm Decision Making: A Review of Literature,http://scholarship.claremont.edu/cmc_theses/3439,2024-01-21,published,4
ESG and Fallen Angels: Investigating the Relationship Between ESG Performance and Bond Returns Over Credit Rating Downgrade Events,http://scholarship.claremont.edu/cmc_theses/2914,2022-02-09,published,42
ESG vs. Non-ESG: Why the Difference?,http://scholarship.claremont.edu/cmc_theses/3387,2023-06-06,published,7
EVs Driving the Stock Market: An Empirical Analysis of the Effect of Electric Vehicle Tax Credits on Stock Price Volatility,http://scholarship.claremont.edu/cmc_theses/2555,2021-02-12,published,3
Earnings Management and Accounting Fraud: Examining the Necessity of Regulation,http://scholarship.claremont.edu/cmc_theses/777,2013-12-29,published,23
Earnings Management in European Football: How Effective is Financial Fair Play?,http://scholarship.claremont.edu/cmc_theses/1169,2015-05-19,published,7
Eating Disorders in Young Women: Social Factors and their Implications for Body-Salient Cultures,http://scholarship.claremont.edu/cmc_theses/2343,2020-01-31,published,2
Economic Considerations for Reducing Greenhouse Gas Emissions from Utility-Scale Electricity Generation in California,http://scholarship.claremont.edu/cmc_theses/1074,2015-05-19,published,11
Economic Cycles and Consumer Preferences: The Impact of Economic Conditions on Movie Genre Popularity,http://scholarship.claremont.edu/cmc_theses/3836,2025-02-03,published,0
Economic Interdependence between Taiwan and Mainland China,http://scholarship.claremont.edu/cmc_theses/1701,2017-05-22,published,13
Economic Propaganda in the United States,http://scholarship.claremont.edu/cmc_theses/2987,2022-05-31,published,1289
Economic Recoil: Analyzing the Stock Market’s Reaction to Mass Shootings in the Firearms Sector,http://scholarship.claremont.edu/cmc_theses/3572,2024-05-22,published,5
Economics Impacts of Genetically Modified Organisms: An analysis of Bt Cotton in India,http://scholarship.claremont.edu/cmc_theses/2255,2019-06-13,published,18737
Ecotourism Enterprises: The Case for Indigenous Community-Owned Tourism in Ecuador,http://scholarship.claremont.edu/cmc_theses/839,2014-05-21,published,98
Eduard Shevardnadze: The Modern Day Machiavel,http://scholarship.claremont.edu/cmc_theses/587,2013-05-21,published,8
Education Inequality in the United States: A Wicked Problem With a Wicked Solution,http://scholarship.claremont.edu/cmc_theses/2780,2021-06-11,published,4301
Education as Democratic Persuasion: Addressing Systemic Inequalities in Brettschneider's Value Democracy,http://scholarship.claremont.edu/cmc_theses/1726,2018-01-04,published,648
Education for Foster Youth: Pennsylvania vs. California,http://scholarship.claremont.edu/cmc_theses/3218,2023-01-18,published,20
"Education in Nazi Germany: Ideology, Hitler Youth, and Elite Schools",http://scholarship.claremont.edu/cmc_theses/1494,2017-01-09,published,21
Educational Pluralism: Charter Schools as Laboratories for Education Reform,http://scholarship.claremont.edu/cmc_theses/1956,2018-05-30,published,12
Effaced: Exploring the Construction of Identity in the Human Cyborg,http://scholarship.claremont.edu/cmc_theses/2908,2022-02-09,published,4
Effect of Dopamine-2-Receptor Manipulation on Social Interaction and Social Decision-Making in Juvenile Fish,http://scholarship.claremont.edu/cmc_theses/3538,2024-04-30,published,0
Effect of Economic Concentration of Chaebols on South Korean Economic Growth,http://scholarship.claremont.edu/cmc_theses/2449,2020-06-18,published,8
Effect of Gender on Bystander Intervention,http://scholarship.claremont.edu/cmc_theses/1016,2015-01-20,published,9
Effect of Lockup Agreements on Buyout Backed Initial Public Offerings,http://scholarship.claremont.edu/cmc_theses/183,2011-05-09,published,673
Effect of Paxlovid on Neurodevelopmental Disorder Diagnosis Outcomes in Offspring of Mothers Infected with SARS-Cov-2 during Pregnancy,http://scholarship.claremont.edu/cmc_theses/3844,2025-02-03,published,1
Effective Environmental Management of the National Park Service: A Case Study of Channel Islands National Park,http://scholarship.claremont.edu/cmc_theses/51,2010-12-01,published,976
Effective Regional Development: A State-Wise Analysis of India,http://scholarship.claremont.edu/cmc_theses/1097,2015-05-19,published,16
Effects of Deregulation on Retirement Savings,http://scholarship.claremont.edu/cmc_theses/536,2013-01-04,published,4
"Effects of Drought on Habitat Quality for Native Bees in Residential Gardens of Claremont, CA",http://scholarship.claremont.edu/cmc_theses/3066,2022-06-02,published,126
Effects of Early Round Venture Capital Syndication on IPO Exits in Europe and the United States,http://scholarship.claremont.edu/cmc_theses/344,2012-05-17,published,1044
Effects of Fundamental Analysis on IPO Valuation in the United States ITS Sector,http://scholarship.claremont.edu/cmc_theses/575,2013-05-20,published,7
Effects of LA Metro Lines on Surrounding Neighborhoods,http://scholarship.claremont.edu/cmc_theses/2814,2022-01-14,published,15
Effects of Learned Exercises on Gross Motor Coordination in Children with ASD,http://scholarship.claremont.edu/cmc_theses/1914,2018-05-30,published,242
Effects of Perceived Group Level Norms on the Relationship between Leader Characteristics and Motivation to Develop Leadership,http://scholarship.claremont.edu/cmc_theses/1184,2015-05-19,published,5
Effects of Priming Independent and Interdependent Self-Construals on Personal and Collective Future Thought,http://scholarship.claremont.edu/cmc_theses/3622,2024-05-22,published,131
Effects of Regulatory Change on Stock Prices and Profitability of Islamic and Conventional Banks in Malaysia,http://scholarship.claremont.edu/cmc_theses/952,2014-05-24,published,2
Effects of Shareholder Activism on Term Interbank Lending Participation in Emergency Liquidity Provisions,http://scholarship.claremont.edu/cmc_theses/3717,2025-01-27,published,1
Effects of Sleep Deprivation and the Link to Alzheimer’s Disease  in Night Shift Workers,http://scholarship.claremont.edu/cmc_theses/2354,2020-01-31,published,598
Effects of The Gut Microbiome on Cardiovascular Health,http://scholarship.claremont.edu/cmc_theses/3505,2024-01-29,published,8
Effects of a Defendant's Age and Intelligence on Juror Perceptions of a Confession,http://scholarship.claremont.edu/cmc_theses/327,2012-05-17,published,5
Effects of male attractiveness on prostaglandin E2 production levels,http://scholarship.claremont.edu/cmc_theses/3240,2023-05-23,published,161
Effects of the Gender of the Real Estate Agents on House Prices,http://scholarship.claremont.edu/cmc_theses/1674,2017-05-22,published,4
Effects of the Injury Recovery Process on Neuromuscular Activation in an Uninjured Ankle,http://scholarship.claremont.edu/cmc_theses/3569,2024-05-22,published,19
"Effects of the Physical Environment on the Spatial Dynamics of Juvenile Astatotilapia burtoni, a Highly Social Cichlid Fish",http://scholarship.claremont.edu/cmc_theses/2509,2020-06-18,published,1
Efficacy of Article V,http://scholarship.claremont.edu/cmc_theses/3692,2024-05-22,published,9
Efficient Use of Force: Evaluating Police Tactics in Reducing Gun Violence,http://scholarship.claremont.edu/cmc_theses/1269,2015-12-23,published,11
Egypt at a Crossroads: an Analysis of Morsi's Strategies of Military Control in the Post-Revolutionary State,http://scholarship.claremont.edu/cmc_theses/497,2013-01-04,published,1097
"Eh, You M?h?? An Analysis of American Cultural Imperialism in Hawai’i through the Lens of Gender and Sexuality",http://scholarship.claremont.edu/cmc_theses/1611,2017-05-19,published,3099
Eigenvalues and Approximation Numbers,http://scholarship.claremont.edu/cmc_theses/2167,2019-06-13,published,386
El Acuerdo de Schengen y El Sistema de Dublín: Su Influencia en La Formación de La Política de Asilo en La Unión Europea,http://scholarship.claremont.edu/cmc_theses/449,2012-05-18,published,1
El Colegio Fundación Fernando Borrero Caicedo: Un sistema educativo alternativo en Colombia,http://scholarship.claremont.edu/cmc_theses/155,2011-05-06,published,125
El Sistema de Pensiones Español: ¿Puede la Inmigración Prevenir una Crisis Futura?,http://scholarship.claremont.edu/cmc_theses/49,2010-12-01,published,253
El guerrero obsidiana,http://scholarship.claremont.edu/cmc_theses/2491,2020-06-18,published,125
El “Gran Experimento” del Socialismo Cubano: Los Retos Durante la Transición Económica,http://scholarship.claremont.edu/cmc_theses/1556,2017-05-17,published,306
Electric Municipalization in the City of Boulder: Successful Greening or Path to Bankruptcy?,http://scholarship.claremont.edu/cmc_theses/562,2013-05-20,published,1197
Electric Vehicles: Exploring the Granularity in California Zip Codes,http://scholarship.claremont.edu/cmc_theses/3645,2024-05-22,published,45
Electric Vehicles: Market Opportunities in China,http://scholarship.claremont.edu/cmc_theses/1,2010-11-24,published,1330
Electrifying Development: Identifying Key Policy Tools For Facilitating Rural Electrification in Sub-Saharan Africa,http://scholarship.claremont.edu/cmc_theses/1153,2015-05-19,published,9
Electrifying Sub-Saharan Africa: Identifying Key Policy Factors in Electrification,http://scholarship.claremont.edu/cmc_theses/2811,2022-01-14,published,3
Electromyographic Analysis of Trunk Muscle Activation During a Throwing Pattern Following Rotator Cuff Mobilization,http://scholarship.claremont.edu/cmc_theses/90,2010-12-09,published,1558
Elements of Employability: The Effects of Workplace Priming on Implicit and Explicit Stereotype Content Associated with Down Syndrome,http://scholarship.claremont.edu/cmc_theses/1553,2017-05-17,published,5
Elliptic Curves and The Congruent Number Problem,http://scholarship.claremont.edu/cmc_theses/1120,2015-05-19,published,2620
Email Me Back: Examining Mental Health Provider Biases through Email Return Rates and Responsiveness,http://scholarship.claremont.edu/cmc_theses/1955,2018-05-30,published,9
Emerging from Behind the Curtain: A Comparative Analysis of Polish and Czech Reforms Based on Quality of Life Improvements,http://scholarship.claremont.edu/cmc_theses/3659,2024-05-22,published,123
Emotional Brand Attachment: Marketing Strategies for Successful Generation,http://scholarship.claremont.edu/cmc_theses/273,2011-12-20,published,11360
Emotions and Entertainment: Finding Private Ryan's Success,http://scholarship.claremont.edu/cmc_theses/730,2013-12-24,published,19
Empathy: A tool to unite?,http://scholarship.claremont.edu/cmc_theses/1943,2018-05-30,published,139
Employee Engagement: Restoring Viability to a Corporate Cliché,http://scholarship.claremont.edu/cmc_theses/1039,2015-01-20,published,2168
Employer-Provided Health Insurance as a Potential Deterrent to Entrepreneurship,http://scholarship.claremont.edu/cmc_theses/1270,2015-12-23,published,13
Employing a Machine Learning Approach in Precision Oncology to Predict PIK3CA Functional Status and Identify Phenocopying Variants of Deleterious PIK3CA Mutations,http://scholarship.claremont.edu/cmc_theses/3580,2024-05-22,published,48
Employment-to-Population Ratio Goes Low: An Analysis of the Recent Aggregate Labor Market Behavior in the United States,http://scholarship.claremont.edu/cmc_theses/1235,2015-12-23,published,2
Empowered or Impaired? The California Parent Empowerment Act vs. Palm Lane Elementary,http://scholarship.claremont.edu/cmc_theses/1798,2018-01-17,published,12
Enabling Successful Environmental Partnerships,http://scholarship.claremont.edu/cmc_theses/688,2013-05-23,published,37
Ending America’s “Endless” Wars: Is a Left/Right Coalition on Non-Interventionist Foreign Policy Feasible?,http://scholarship.claremont.edu/cmc_theses/2425,2020-06-18,published,309
Endorsing Solidarity: Root Causes of Riots & Viable Solutions,http://scholarship.claremont.edu/cmc_theses/475,2012-05-21,published,2
"Energy Efficiency Technologies for Buildings: Potential for Energy, Cost, and Carbon Emission Savings",http://scholarship.claremont.edu/cmc_theses/180,2011-05-09,published,1200
Energy Storage: Technology for a More Efficient Grid,http://scholarship.claremont.edu/cmc_theses/264,2011-12-20,published,863
Energy as a Limiting Factor in Neuronal Seizure Control: A Mathematical Model,http://scholarship.claremont.edu/cmc_theses/3060,2022-06-02,published,19
Engines of Change: China's Rise and the Chinese Auto Industry,http://scholarship.claremont.edu/cmc_theses/766,2013-12-26,published,2091
"Engines of Division: The Trabant, Economic Lag, and Cultural Fragmentation in a Unified Germany",http://scholarship.claremont.edu/cmc_theses/3764,2025-01-28,published,9
"Enter  Stage  Left: How  Demographic  Change, Trump, and  the  Texas  GOP  will Make Room for the Texas Democrats to Return from Exile in 2016",http://scholarship.claremont.edu/cmc_theses/1447,2016-09-20,published,4
Entre Piedra y Pared: A Multi-Level Analysis of Housing and Immigration Policies’ Effect on Undocumented Immigrants in Mexico City,http://scholarship.claremont.edu/cmc_theses/2824,2022-01-14,published,274
Entremezclando Sueños: Reimagining Education Through Community-Centered Program Evaluations,http://scholarship.claremont.edu/cmc_theses/3668,2024-05-22,published,59
Entrepreneurial Spirit and Immigrant Self-employment,http://scholarship.claremont.edu/cmc_theses/2055,2019-02-15,published,13
Entrepreneurship Policy in Latin America: Are Science and Technology Innovation Overemphasized?,http://scholarship.claremont.edu/cmc_theses/896,2014-05-24,published,5
Environmental Controls on the Spatial Distribution of Greenfin Darters and Biodiversity in the Blue Ridge Mountains,http://scholarship.claremont.edu/cmc_theses/2591,2021-02-12,published,196
Environmental Degradation Caused by Turkish Incursions and Practices in Kurdish Areas,http://scholarship.claremont.edu/cmc_theses/3068,2022-06-02,published,9
Environmental Inequities in U.S. Public Schooling,http://scholarship.claremont.edu/cmc_theses/1416,2016-05-26,published,4
Environmental Justice Litigation in California: How Effective is Litigation in Addressing Slow Violence?,http://scholarship.claremont.edu/cmc_theses/1467,2017-01-05,published,1735
Environmental Sustainability On College Campuses:  A Case Study of Claremont McKenna College,http://scholarship.claremont.edu/cmc_theses/1536,2017-02-24,published,8
Epigenetics: Blurring the Line Between Nature and Nurture,http://scholarship.claremont.edu/cmc_theses/33,2010-11-30,published,2513
Epistemic Injustice and Communities of Resistance,http://scholarship.claremont.edu/cmc_theses/1937,2018-05-30,published,8
Equality and Excellence: Providing Quality Opportunities in Women’s  Athletics through Title IX,http://scholarship.claremont.edu/cmc_theses/3726,2025-01-27,published,7
Equality in Context: An Evaluation of Pure and Efficiency-Integrated Measurements of Inequality,http://scholarship.claremont.edu/cmc_theses/2362,2020-06-18,published,2
"Equality, Freedom, and Basic Income: On the Evolution of Justifications for Social Minimums and the Case for a Democratic Egalitarian Basic Income Proposal",http://scholarship.claremont.edu/cmc_theses/2535,2021-02-12,published,7
Equity financing choices as a market signal? Differences in CVC and IVC-backed companies’ Tobin’s Q post-IPO,http://scholarship.claremont.edu/cmc_theses/3212,2023-01-18,published,21
Equity is the New Black: Examining Changes in the Executive Compensation Structures of Internet Companies,http://scholarship.claremont.edu/cmc_theses/1298,2015-12-23,published,35
Ergodic and Combinatorial Proofs of van der Waerden's Theorem,http://scholarship.claremont.edu/cmc_theses/14,2010-11-30,published,721
Escaping the Poverty Trap: Formal Savings and Asset Accumulation in Rural Malawi,http://scholarship.claremont.edu/cmc_theses/1436,2016-05-26,published,1138
Escaping the Snowstorm: Legal Rights and Economics in the Developing World,http://scholarship.claremont.edu/cmc_theses/2368,2020-06-18,published,80
Esports in Korea: A study on League of Legends team performances on the share price of owning corporations,http://scholarship.claremont.edu/cmc_theses/1356,2016-05-26,published,5019
Establishing a Viable Protected Area in Sub-Saharan Africa,http://scholarship.claremont.edu/cmc_theses/2151,2019-06-13,published,7
Estimating The Size Of The Pharmaceutical Patent Cliff,http://scholarship.claremont.edu/cmc_theses/854,2014-05-24,published,2
